feature,version,desc,orig,verdict,d_rf_reg,d_lgb_reg,d_ridge,d_rf_clf,d_xgb_clf,d_avg_reg,d_avg_clf,d_avg_all
circ_sc_rate,v3.95,Avg SC per race at circuit (last 5yr),v381,KEEP,-1.9090909090909083,1.045454545454545,0.5,1.4545454545454533,-0.09090909090908994,-0.43181818181818166,0.6818181818181817,0.2
circ_vsc_rate,v3.96,Avg VSC per race at circuit (last 5yr),v382,KEEP,1.9545454545454533,0.0,0.0,-0.5909090909090899,-0.45454545454545503,0.9772727272727266,-0.5227272727272725,0.18181818181818166
circ_sc_vsc_combined,v3.97,SC+VSC total disruption,v383,DISCARD,0.045454545454546746,-2.5909090909090917,0.0,1.6818181818181817,0.7272727272727266,-1.2727272727272725,1.2045454545454541,-0.027272727272727337
circ_avg_pit_stops,v3.98,Avg pit stops per race at circuit (last 5yr),v384,DISCARD,-1.9090909090909083,-2.3181818181818183,0.0,0.545454545454545,0.6818181818181817,-2.1136363636363633,0.6136363636363633,-0.6
circ_pit_stop_var,v3.99,Variance pit stops at circuit,v385,KEEP,0.1363636363636367,-1.045454545454545,0.0,2.6363636363636367,0.1363636363636367,-0.45454545454545414,1.3863636363636367,0.372727272727273
drv_q3_rate,v4.00,Driver Q3 rate last 10 sessions,v386,DISCARD,-3.9090909090909083,-0.045454545454546746,-0.6363636363636367,-2.8181818181818183,1.1818181818181817,-1.9772727272727275,-0.8181818181818183,-1.2454545454545456
drv_q2_elim_rate,v4.01,Driver Q2 elimination rate last 10,v387,DISCARD,-0.6818181818181817,0.18181818181818166,0.2727272727272734,-4.772727272727273,-0.40909090909091006,-0.25,-2.5909090909090917,-1.081818181818182
